Title,Note,Id,Date de Sortie,Age Rating,Franchise,Genres,Hypes,nb_languages,nb_platforms,Themes,Collection,Graphismes,Publisher,Developer,Multiplayer,Perspective,Similar Games,Game Engine,Summary,Storyline
World to the West,73,27518,2017,Tout Public,NA,"['Puzzle', 'Role-playing (RPG)', 'Adventure', 'Indie']",1,23,7,"['Action', 'Fantasy']",Yes,2073600,"['SOEDESCO Publishing', 'Rain Games']",['Rain Games'],NA,Bird view / Isometric,"[18869, 24426, 28309, 36198, 47823, 55190, 80916, 96217, 106987, 113360]",Unity,"World to the West is a pulpy, cartoony top down action adventure inspired by European adventure comics. Take control of four unique characters —Lumina the Teslamancer, Knaus the orphan, Miss Teri the mind bender and the gloriously mustachioed strongman, Lord Clonington—, each with their their own motivations, skills and interweaving storylines, as they seek to escape the dark shadow of an ancient prophecy. Travel trough corrupt colonies, lush jungles and frozen tundras, as you snoop through the secrets of a forgotten civilization.",
Creativerse,N/A,17112,2017,NA,NA,"['Role-playing (RPG)', 'Simulator', 'Adventure', 'Indie']",0,1,2,"['Action', 'Science fiction', 'Sandbox', 'Open world']",Yes,1190400,['Playful Corporation'],['Playful Corporation'],Yes,First person,"[1877, 17548, 21564, 25311, 26574, 35994, 37419, 47823, 105269, 113360]",NA,"Stranded in a vast, mysterious world. Surrounded by ferocious beasts and remnants of ancient technology. Awash in treasure, treacherous catacombs and breathtaking vistas...

Adventure awaits — From the highest peaks to the furthest depths, through jungles, deserts, and swamps, over pools of acid and lakes of lava, there’s something to discover around every corner, whether it’s rare materials, curious terrain or a pack of vicious cave dwellers hellbent on your destruction.
Colossal creativity — Construct powerful tools, discover secret recipes and unlock a vast trove of building materials. Add creature taming, farming and gadgets like teleporters to the mix and you’ve got tremendous world-shaping power at your fingertips.",
Birthdays the Beginning,65,26611,2017,Tout Public,NA,"['Simulator', 'Strategy']",0,18,3,"['Sandbox', 'Open world']",Yes,1190400,"['Arc System Works', 'NIS America']","['Arc System Works', 'Toybox Inc.']",NA,Bird view / Isometric,"[10032, 26574, 34823, 37419, 44242, 51577, 55689, 102163, 111187, 117717]",NA,"""From the legendary creator, Mr. Yasuhiro Wada (TOYBOX Inc.), comes Birthdays the Beginning: a new sandbox game in which players create cube-shaped worlds that give rise to diverse and unique lifeforms. With careful experimentation, players can shape the geography and alter the temperature of each world to create the conditions for life and witness the birth of an entire ecosystem!""",
Butcher,71,24839,2016,18 year,NA,"['Shooter', 'Platform', 'Indie', 'Arcade']",0,13,6,"['Action', 'Science fiction']",Yes,2073600,"['Crunching Koalas', 'Transhuman Design']",['Transhuman Design'],NA,Side view,"[3227, 7350, 11646, 18182, 26855, 36198, 55042, 55190, 56033, 103298]",NA,"Butcher is a fast-paced 2D shooter game and a blood-soaked love letter to the early 90s. As a cyborg programmed to eradicate the last remains of humanity, your sole purpose is to well... annihilate anything that moves.

So grab your weapon of choice (from chainsaw, through shotgun, to grenade launcher) and kill your way through underground hideouts, post-apocalyptic cities, jungles and more. And if you're feeling creative, there are plenty other ways of ending your enemies' misery - hooks, lava pits, saws... no death will ever be the same.",
Elliot Quest,76,8596,2014,Tout Public,NA,"['Platform', 'Role-playing (RPG)', 'Adventure', 'Indie']",0,12,7,['Action'],Yes,2073600,['PlayEveryWare'],"['PlayEveryWare', 'Ansimuz Games']",NA,Side view,"[16992, 19150, 24426, 33153, 36198, 55173, 55190, 56033, 96217, 106987]",NA,"Elliot Quest is an adventure/RPG where players explore the mysterious Urele island in search of an ancient demon. With 5 dungeons to conquer, 16 bosses to defeat, and countless treasures to discover and hidden areas. Well-balanced gameplay easy to pick up but challenging to master.",
LocoRoco Remastered,83,26234,2017,Tout Public,NA,"['Platform', 'Puzzle', 'Adventure']",1,0,1,['Action'],Yes,8294400,['Sony Interactive Entertainment'],['Sony Interactive Entertainment'],NA,Side view,"[19241, 20342, 24426, 25646, 28070, 55173, 55190, 56033, 89597, 110503]",NA,"The peaceful world of the LocoRoco is under attack by the not-so-nice Moja Corps! These evil outer space creatures have come to take the LocoRoco from their land of blowing flowers, lively creatures and pastel scenery. You must move the LocoRoco through more than 40 levels of slippery slopes, teetering platforms, and maze-like passages. The LocoRoco have the uncanny ability to fluidly morph to their landscape, so all you need is to tilt, roll, and bounce the happy blob-like creatures to safety.",
Moonshot Galaxy,N/A,32658,2016,Tout Public,NA,"['Platform', 'Puzzle', 'Indie']",0,3,3,['Science fiction'],Yes,NA,['Big Fish Games'],['Liftoff Labs'],NA,Virtual Reality,"[17130, 20342, 24426, 25222, 28070, 55173, 55190, 56033, 89597, 106992]",NA,Planetary challenges in exotic branches of the galaxy!,
NBA Playgrounds,63,28081,2017,Tout Public,NA,"['Sport', 'Arcade']",1,8,4,[],Yes,2073600,"['Mad Dog Games, LLC']",['Saber Interactive'],Yes,Bird view / Isometric,"[15851, 23304, 27419, 56033, 96487, 103218, 114285, 116353, 121036, 150098]",NA,"""Classic NBA arcade action is back! Take your “A” game to the playground and beat the best in high-flying 2-on-2 basketball action. Practice your skills offline, play with up to three others, or take your talents online to posterize your opponents with acrobatic jams and ridiculous displays of skill.""",
Polybius,84,24868,2017,Tout Public,NA,['Arcade'],0,1,3,['Action'],Yes,2073600,['Llamasoft LTD'],['Llamasoft LTD'],NA,Virtual Reality,"[10605, 15851, 25640, 43367, 87668, 87728, 90965, 112078, 113895, 117939]",NA,"Polybius is the latest trance-shooter from the creators of Tempest 2000 and TxK, Llamasoft.",
Revenant Saga,53,31472,2014,16 year,NA,"['Role-playing (RPG)', 'Simulator', 'Strategy', 'Adventure', 'Indie']",0,8,9,['Fantasy'],Yes,2073600,['Kemco'],['Exe Create'],NA,Bird view / Isometric,"[19404, 22387, 24426, 25311, 26574, 35994, 36198, 79134, 96217, 109339]",NA,"Become a Revenant and find the truth beyond revenge in this gothic fantasy RPG with stunning 3D battles! Boasting a story that blurs the lines between good and evil, a refined 3D battle system, and plenty of content to go around, this is one title not to be missed!",
Strafe,64,9062,2017,16 year,NA,"['Shooter', 'Indie', 'Arcade']",6,6,4,"['Action', 'Science fiction']",Yes,2073600,['Devolver Digital'],['Pixel Titans'],NA,First person,"[3222, 10964, 11646, 18869, 19301, 54844, 103298, 105269, 107318, 113114]",Unity,"Strafe is a singleplayer 3D action experience where the player can pick up a gun and shoot hordes of things in the face. The developers have created technology that changes the levels every time you play for endless replayability. There are billions of experiences to be had with crazy secrets to find! We give you the levels, you paint them red.","It’s your yearly scrapping mission, but this year is different. Your humble scout ship has been recruited to join the massive spacecraft ICARUS. They plan to head to far edge of the galaxy, to a remote sector where other scrappers have not yet dared to venture.

The rewards could be unimaginable. But so are the risks. It may be unexplored space, but it’s a gamble you know you must take.

You lost.

You return from a run empty handed, but worse, ICARUS is no where to be found. You check your coordinates. You try the coms. No answer from your comrades on ICARUS. Yet their teleporter appears in-range and responsive.

So you grab a gun “just in case” and teleport onto ICARUS. What could go wrong?"
Butcher,71,24839,2016,18 year,NA,"['Shooter', 'Platform', 'Indie', 'Arcade']",0,13,6,"['Action', 'Science fiction']",Yes,2073600,"['Crunching Koalas', 'Transhuman Design']",['Transhuman Design'],NA,Side view,"[3227, 7350, 11646, 18182, 26855, 36198, 55042, 55190, 56033, 103298]",NA,"Butcher is a fast-paced 2D shooter game and a blood-soaked love letter to the early 90s. As a cyborg programmed to eradicate the last remains of humanity, your sole purpose is to well... annihilate anything that moves.

So grab your weapon of choice (from chainsaw, through shotgun, to grenade launcher) and kill your way through underground hideouts, post-apocalyptic cities, jungles and more. And if you're feeling creative, there are plenty other ways of ending your enemies' misery - hooks, lava pits, saws... no death will ever be the same.",
Rakuen,84,28544,2017,Tout Public,NA,"['Role-playing (RPG)', 'Adventure', 'Indie']",0,22,4,['Fantasy'],Yes,1190400,['Laura Shigihara'],['Laura Shigihara'],NA,Bird view / Isometric,"[9278, 19150, 22387, 24426, 33153, 36198, 96217, 106987, 113360, 115653]",RPG Maker XP,A hospitalized Boy comes to terms with his own story by traveling with his Mom to a beautiful fantasy world; ultimately helping his fellow patients find closure by walking a mile in their shoes.,"Rakuen is an adventure game about a little Boy who lives in the hospital. One day, the Boy asks his Mom to escort him to the fantasy world from his favorite storybook, so that he can ask the Guardian of the Forest to grant him one wish. In order to receive his wish, the Boy must complete a set of challenges that revolve around helping his neighbors in the hospital by interacting with their alter-egos in the fantasy world...

...A cranky old man who guards a broken music box with his life while complaining that he never gets any visitors; a young woman in a coma whose husband hasn’t left her side in months; a little girl who laments over a friend she was never able to say goodbye to after growing ill… The Boy slowly begins to realize that his neighbors are plagued by secrets and struggles that are mysteriously tied to the strange hospital."
Elliot Quest,76,8596,2014,Tout Public,NA,"['Platform', 'Role-playing (RPG)', 'Adventure', 'Indie']",0,12,7,['Action'],Yes,2073600,['PlayEveryWare'],"['PlayEveryWare', 'Ansimuz Games']",NA,Side view,"[16992, 19150, 24426, 33153, 36198, 55173, 55190, 56033, 96217, 106987]",NA,"Elliot Quest is an adventure/RPG where players explore the mysterious Urele island in search of an ancient demon. With 5 dungeons to conquer, 16 bosses to defeat, and countless treasures to discover and hidden areas. Well-balanced gameplay easy to pick up but challenging to master.",
Minecraft,82,121,2011,Tout Public,NA,"['Simulator', 'Adventure']",0,21,3,"['Fantasy', 'Survival', 'Sandbox', 'Kids', 'Open world']",Yes,2073600,['Mojang Studios'],['Mojang Studios'],Yes,First person,"[472, 533, 1020, 1164, 1879, 1942, 1991, 3025, 3225, 7346]",Lightweight Java Game Library,"Minecraft focuses on allowing the player to explore, interact with, and modify a dynamically-generated map made of one-cubic-meter-sized blocks. In addition to blocks, the environment features plants, mobs, and items. Some activities in the game include mining for ore, fighting hostile mobs, and crafting new blocks and tools by gathering various resources found in the game. The game's open-ended model allows players to create structures, creations, and artwork on various multiplayer servers or their single-player maps. Other features include redstone circuits for logic computations and remote actions, minecarts and tracks, and a mysterious underworld called the Nether. A designated but completely optional goal of the game is to travel to a dimension called the End, and defeat the ender dragon.","Minecraft: Java Edition (previously known as Minecraft) is the original version of Minecraft, developed by Mojang Studios for Windows, macOS, and Linux. Notch began development on May 10, 2009, publicly releasing Minecraft on May 17, 2009. The full release of the game was on November 18, 2011, at MINECON 2011."
Demon's Crystals,70,20402,2016,Tout Public,NA,"['Fighting', 'Shooter', 'Indie', 'Arcade']",0,5,6,['Action'],Yes,2073600,['Badland Publishing'],"['Byte4Games', 'StarCruiser Studio']",Yes,Bird view / Isometric,"[3277, 7350, 11423, 11646, 19082, 27419, 28113, 43367, 56033, 76110]",NA,"Demon's Crystals is a frenetic twin stick shooter where you guide the Urican demons through countless hazards in order to restore peace to the world. A variety of weapons and power-ups will help you defeat the massive enemy hordes. The Urican have always been at the top of the food pyramid, but one day three mysterious beings arrived causing the once peaceful inhabitants of the world to become aggressive and destructive. Now these astral demons must fight to survive.",
To the Moon,81,5025,2011,Tout Public,NA,"['Point-and-click', 'Puzzle', 'Role-playing (RPG)', 'Adventure', 'Indie']",0,14,6,"['Science fiction', 'Drama', 'Romance']",Yes,2073600,"['Freebird Games', 'X.D. Network Inc.']","['Freebird Games', 'Freebird Games']",NA,Bird view / Isometric,"[1331, 1334, 1906, 2939, 3188, 7386, 9498, 11233, 11270, 36044]",RPG Maker XP,"Join Dr. Rosalene and Dr. Watts as they enter a patient named Johnny's mind on his death bed to grant his final request. Watch, interact, and change the past as Johnny's life unfolds before you and takes you on a magical journey inside one's head that asks the greatest question of all: ""What if...?""
If you had the chance to relive your life, would you change things? Would you try to achieve some grand goal? Could you find love? Fame? Fortune? Or would you realize that sometimes the past is meant to stay the same. Join Dr. Rosalene and Watts on their journey and travel To The Moon.","Sigmund Corp. uses a technology that can create artificial memories. They offer this as a ""wish fulfillment"" service to people on their death beds. Since these artificial memories conflict with the patient's real memories, the procedure is only legal to do on people without much time left to live.

Sigmund Corp. employees Dr. Eva Rosalene and Dr. Neil Watts are tasked with fulfilling the lifelong dream of the dying Johnny Wyles. Johnny wants to go to the moon, although he doesn't know why. The doctors insert themselves into an interactive compilation of his memories and traverse backwards through his life via mementos. With each leap to an important moment in Johnny's memories, they learn more about him and what brought him to his current position in life, including his largely unhappy marriage to his childhood sweetheart, River. Upon reaching his childhood, the doctors attempt to insert his desire to go to the moon. Supposedly, Johnny's mind would create new memories based on that desire, and Johnny would die believing he lived without any regrets.

However, Johnny's mind does not create the new memories as planned. Dr. Watts and Dr. Rosalene must solve the problem to fulfill Johnny's dying wish of going to the moon.

Eventually, it is revealed that Johnny and River met as children at a carnival. They looked at the night sky and made up a constellation: a rabbit with the moon as its belly. The two agreed to meet at the same place the following year, with Johnny promising that should he forget or get lost, the two would ""regroup on the moon"". That night, Johnny gives River a toy platypus which River treasures for the rest of her life. Shortly after, Johnny's twin brother Joey was killed in an accident. Johnny's mother gave him beta blockers to induce memory loss of the tragic event, also causing him to forget his first encounter with River. He later happened to meet her again, and eventually marry her, and River only realized later on that he had forgot their meeting at the carnival. (Johnny confessed that he approached her in school because she was different, and revealed that he thought that was their first meeting) River, diagnosed as an adult with Asperger syndrome (although never directly stated, the game references Tony Attwood, who wrote numerous books about Aspergers), did not tell Johnny directly about their first meeting; instead, she tried to indirectly jostle his memories by cutting her hair and crafting paper bunnies, including a dual-colored one representing the constellation they made up during their first encounter, combined with the blue-and-yellow dress she wore on their wedding. River was unable to make Johnny remember before she died, and Johnny was left with lingering guilt and an inexplicable desire to go to the Moon.

In the present, Rosalene and Watts eventually implant a memory sequence in which Joey did not die, and lived on to become a popular author, and Johnny did not meet River again until they started working together at NASA. As the comatose real-life Johnny begins to die, he imagines going on a moon mission with River. During the launch, River holds out a hand to him. The moon appears through a window on the ship, and Johnny takes her hand as his heart monitor flatlines.

In the epilogue, Johnny and River eventually get married, and build and retire to the same house where the real-life Johnny and River lived. Back in the real world, Rosalene and Watts look to Johnny's grave, which is placed adjacent to River’s. They reveal to the audience that Johnny willed the house to his caregiver, Lily. Rosalene receives a phone call, and the two move on to their next patient. While Watts is leaving, he stops and the screen briefly flashes red, the same way it did when Johnny felt pain. Watts takes some painkillers, then continues onward."
Akiba's Beat,55,19465,2016,Tout Public,NA,['Role-playing (RPG)'],2,0,2,"['Action', 'Fantasy', 'Science fiction']",Yes,1159200,"['ACQUIRE Corp.', 'Digital Touch', 'XSEED Games', 'PQube']",['ACQUIRE Corp.'],NA,Third person,"[19164, 54775, 55038, 55199, 81249, 96217, 103303, 106987, 113636, 115280]",NA,"Akiba's Beat is an action RPG developed by Acquire and is the sequel to Akiba's Trip.
The game takes place in Akihabara where the party getting stuck in a world of delusions, trapped in a repeating day-long cycle on a Sunday.",
Deemo: The Last Recital,88,26996,2015,Tout Public,NA,"['Music', 'Adventure']",1,0,1,['Mystery'],Yes,NA,"['Rayark Inc.', 'PM Studios']",['Rayark Inc.'],NA,First person,"[18011, 18981, 26223, 27092, 27725, 63933, 77720, 80916, 81275, 82995]",NA,"Experience Deemo: The Last Recital, a music rhythm game and story of urban fantasy.

Deemo is a mystic being that lives in solitude in a castle all by itself. His life changes when a little girl who lost her memories, unknowingly falls from the sky, not knowing who she is and where she came from. Deemo comes to realize that whenever he plays the piano, a tree in front of him grows taller and taller. Confident that the tree can grow tall enough to help the little girl reach the sky from where she came from, the two come together to play the piano together. Can Deemo help the little girl regain her memories and help her get back home?

Enjoy all remade high quality animations as well as new modes: “After Story”, “Duet” and “Duel” exclusively for PS Vita!","Deemo is a mystic being that lives in solitude in a castle all by itself. His life changes when a little girl who lost her memories, unknowingly falls from the sky, not knowing who she is and where she came from. Deemo comes to realize that whenever he plays the piano, a tree in front of him grows taller and taller. Confident that the tree can grow tall enough to help the little girl reach the sky from where she came from, the two come together to play the piano together. Can Deemo help the little girl regain her memories and help her get back home?"
Farpoint,71,19575,2017,16 year,NA,"['Shooter', 'Adventure']",6,0,1,"['Action', 'Science fiction']",Yes,8294400,['Sony Interactive Entertainment'],['Impulse Gear'],NA,Virtual Reality,"[1877, 10964, 19564, 26192, 37016, 55038, 103301, 105269, 107318, 113114]",NA,"Farpoint is an unnerving VR space adventure set on a hostile alien planet. On a mission to pick up scientists studying an anomaly near Jupiter, a rupture from the anomaly transports the player and scientists to an unknown alien world.",
Future Unfolding,76,25803,2017,Tout Public,NA,"['Puzzle', 'Adventure', 'Indie']",1,6,3,"['Action', 'Mystery']",Yes,3686400,['Spaces of Play UG'],['Spaces of Play UG'],NA,Bird view / Isometric,"[18869, 19150, 25646, 26223, 28309, 36198, 55173, 55190, 56033, 80916]",Custom built engine,Future Unfolding lets you explore a mysterious landscape filled with life. Decipher the surreal logic of its world and open up new areas to discover.,
Hakuoki: Kyoto Winds,83,25747,2015,Tout Public,NA,"['Adventure', 'Visual Novel']",0,7,2,"['Fantasy', 'Historical', 'Drama', 'Romance']",Yes,1190400,['Idea Factory'],"['Otomate', 'Design Factory']",NA,Text,"[11458, 12328, 55984, 62151, 79134, 96217, 106987, 114150, 115653, 129997]",NA,"""This remastered telling of the beloved, visual novel Hakuoki series that was first developed and released in 2008 focuses on the story set in Kyoto. The young Chizuru, determined to find her father, will romance the famous samurai of Shinsengumi through a series of engaging stories and dramatic events. Now, experience new characters, love interests, and episodes in the world of Hakuoki: Kyoto Winds this Spring 2017!""","The Bakumatsu period, a gap between the past splendour of the Shogunate era and the modern glamor of the Meiji period, is one of the most violent and intriguing places to start a romance.

Chizuru Yukimura has set off for Kyoto to find her missing father, but accidentally gets herself wrapped up in the intrigues of the Shinsengumi, a group of warriors who defends the fading powers of the shogunate.

The men in Shinsengumi are not merely fighting Emperor Meiji's forces and the strange demons, they are also hiding a terrible secret. They are hiding something among them."
Injustice 2,87,19470,2017,16 year,NA,['Fighting'],20,31,3,['Action'],Yes,1590000,['WB Games'],['NetherRealm Studios'],No,Side view,"[4755, 7498, 19560, 19564, 19565, 25076, 27789, 36911, 36926, 72605]",NA,"Power up and build the ultimate version of your favorite DC legends in INJUSTICE 2. With a massive selection of DC Super Heroes and Super-Villains, INJUSTICE 2 allows you to equip every iconic character with unique and powerful gear earned throughout the game. Experience an unprecedented level of control over how your favorite characters look, how they fight, and how they develop across a huge variety of game modes. This is your super Hero. Your Journey. Your Injustice.",
Operation Babel: New Tokyo Legacy,63,25593,2015,Tout Public,NA,"['Role-playing (RPG)', 'Adventure']",0,5,2,"['Fantasy', 'Science fiction']",Yes,1190400,"['5pb.', 'NIS America']",['Experience Inc.'],NA,First person,"[25311, 26845, 55038, 55199, 81249, 96217, 103303, 106987, 113360, 115653]",NA,"Operation Babel is a first person RPG dungeon crawler with turn-based battles using a customized team of 6 characters.

Operation Babel is the sequel to Operation Abyss: New Tokyo Legacy and the remake of the third game in the Generation Xth trilogy, Code Realize.

""Continue the story of Operation Abyss and defend near-future Tokyo from a new threat in this dungeon crawling RPG. When a mysterious object - dubbed ‘the Embryo’ - appears in the sky, the CPA and the Xth Squad are mobilized to face the new threat. Venture into challenging new labyrinths and create the perfect team to challenge each threat. Featuring a mysterious new story, unprecedented character customization through the new ‘Sub-Blood’ system, and item-based character ability modifications, Operation Babel: New Tokyo Legacy will give you a world to lose yourself in.""",
Seasons After Fall,75,15821,2016,Tout Public,NA,"['Platform', 'Puzzle', 'Role-playing (RPG)', 'Adventure', 'Indie']",2,13,5,['Action'],Yes,1190400,['Focus Entertainment'],['Swing Swing Submarine'],No,Side view,"[20342, 24426, 25646, 28070, 55173, 55190, 56033, 89597, 96217, 106987]",NA,"Seasons after Fall is a game about adventure and exploration, crafted with gorgeous two-dimensional visuals. 
 
The spirits of the four seasons are gone. Something is definitely happening in the forest, something that never happened before. Is this true? Travel in search of the spirits to bring them back in their steles and use their power to explore the world of Seasons after Fall. 
 
You are a wild fox embarked upon a perilous adventure, with mystical powers that allow you to manipulate the seasons, and the life of the forest. Powers that allow you to modify the environment by summoning one of the four seasons, whenever and wherever you wants. 
 
Changing the seasons will modify organic platforming elements that will move or expand based on which season you switch too, altering your relationship with the game and its characters. Seasons after Fall encourages the player to explore a gorgeous 2D graphical world, accompanied by an enchanting soundtrack recorded by a live string quartet. Travel in search of the Four Guardians of Seasons, and become the master of the seasons they protect. 
 
Summon winter to freeze a waterfall to pass, or call for Spring to feed a plant that will guide you to a previously inaccessible zone. Travel across forests, rivers and caves, and manipulate an ecosystem that is as disturbing as it is marvelous to unveil the secrets of this world.",
