Title,Note,Id,Date de Sortie,Age Rating,Franchise,Genres,Hypes,nb_languages,nb_platforms,Themes,Collection,Graphismes,Publisher,Developer,Multiplayer,Perspective,Similar Games,Game Engine,Summary,Storyline
Ride 2,69,19803,2016,Tout Public,NA,"['Racing', 'Simulator', 'Sport']",0,14,3,['Non-fiction'],Yes,2073600,"['Square Enix', 'Milestone']",['Milestone'],No,First person,"[101439, 102805, 103218, 107196, 114286, 114287, 116667, 117855, 118871, 120126]",NA,"The second edition of Milestone's innovative racing game is focused on the relationship between the rider and motorcycle, bringing the connection between man and machine even closer with career mode and other new features. Players can race the motorcycle of their dreams, thanks to unprecedented customization options for both rider and bike – and create the ultimate ride down to the finest detail.","Welcome to the temple of motorcycles, the only digital garage that will allow you to discover, transform and test the world’s fastest, most iconic and original vehicles.
The top of the range of the most famous brands will await you to compete against each other in a unique video game and show the world their full potential!
Over 170 bikes are the undisputed protagonists of the new chapter of this long-waited two-wheel racing game! Feel the adrenaline rush through your veins and face the most dreadful bends with the passion and the boldness of a professional rider!
RIDE 2 will include the tracks of the wildest and most exciting races of all time! Country, City, GP, Road, Motard and Drag race: challenge the toughest types of roads and leave a slipstream at every squeal of tires!"
Sniper Elite 4,77,18366,2017,16 year,NA,"['Shooter', 'Tactical', 'Adventure']",9,32,5,"['Action', 'Historical', 'Stealth', 'Open world', 'Warfare']",Yes,2073600,['Rebellion Developments'],['Rebellion Developments'],Yes,Third person,"[1877, 17446, 19164, 19549, 19564, 90099, 103054, 106805, 117497, 118218]",Asura,"Sniper Elite 4 combines genre-defining ballistics, breathless emergent stealth, and gripping third person action across the largest and most diverse environments ever seen in a Sniper Elite game.

Set in the aftermath of its award-winning predecessor, Sniper Elite 4 continues the series’ World War Two heritage by transporting players across the beautiful Italian peninsula, from sun-drenched Mediterranean coastal towns, to colossal Nazi mega structures, daunting forests and giddying mountain monasteries inspired by Monte Cassino.

Covert agent and elite marksman Karl Fairburne must fight alongside the brave men and women of the Italian Resistance to help free their country from the yoke of Fascism, and defeat a terrifying new threat with the potential to halt the Allied fightback in Europe before it’s even begun.

If his mission fails, there will be no Operation Overlord, no D-Day landings, and no Victory in Europe.",
Berserk and the Band of the Hawk,66,19765,2016,18 year,NA,"[""Hack and slash/Beat 'em up""]",4,3,4,"['Action', 'Fantasy', 'Horror']",Yes,2073600,['Koei Tecmo Games'],['Omega Force'],NA,Third person,"[24426, 28010, 54775, 55028, 96217, 103168, 103288, 111130, 114009, 116530]",NA,"Behold the fierce blend of ""Warriors"" and ""Berserk""!

The action of cutting through hundreds of enemies, fundamental to the Warriors series, is fused together with the dark and gruesome atmosphere of the world of ""Berserk"", making various heretofore unseen acts possible, such as using a giant man-sized sword to cut enemies in half, as well as smash or send them flying with the ""Slash"" and ""Smash"" actions.",
Halo Wars 2,79,11570,2017,16 year,NA,"['Real Time Strategy (RTS)', 'Strategy']",11,0,2,['Science fiction'],Yes,2289600,['Microsoft Studios'],"['The Creative Assembly', '343 Industries']",No,Bird view / Isometric,"[9789, 11186, 11666, 16287, 17111, 19539, 19564, 25076, 36872, 37016]",NA,"After decades adrift and declared “lost with all hands,” the brave crew of the UNSC Spirit of Fire are mysteriously awoken above an ancient Forerunner haven known as the Ark. In Halo Wars 2, Captain Cutter and his crew will face one of humanity’s most formidable threats yet: The Banished – a fierce and powerful Brute faction led by a cunning and lethal warrior known as Atriox.

Halo Wars 2 delivers real-time strategy at the speed of Halo combat. Get ready to lead armies of Spartans and other Halo fighting forces like Warthogs, Scorpions and exciting new units in a brutal war against a terrifying new enemy on the biggest Halo battlefield yet.",
Night in the Woods,88,10148,2017,16 year,NA,"['Platform', 'Adventure', 'Indie']",5,4,8,"['Fantasy', 'Drama']",Yes,2073600,['Finji'],['Infinite Fall'],No,Side view,"[3222, 11800, 18822, 18869, 22387, 23733, 26226, 36198, 55190, 56033]",Unity,"Night In The Woods is an adventure game heavily focused on story, characters and exploration, with some platforming to get around town. Mae's a cat so the roofs and ledges and powerlines are all her playground, and she's not the only one up there by a long shot. You'll also be doing various activities and interacting with the world in different ways, getting to know the townspeople, hanging out with friends, exploring Possum Springs inside and out, and venturing into the surrounding areas.","Night In The Woods is a VIDEO GAME. All Mae wants to do is run around with her friends, break stuff and hang on to a life of aggressive aimlessness. She dropped out of college and returned home to her crumbling old mining town to do just that, but she's finding that nothing is the same anymore. The old town seems different. Her old friends have grown in their own directions. Mae herself is undergoing some sudden and unexplained changes, giving her mysterious abilities that grant her access to a side of town she never knew existed.
The world is changing, things are ending, and the future is uncertain. Up behind the park at the edge of town, back in the trees by the old mine- there's something in the woods. And it could mean no future at all.
Night In The Woods comes from a deep place for us. That point where you sense things are changing and it's time to move on but you just don't know how. Knowing that everything will end someday, and wondering how well we'll be able to meet it when it happens. How long we'll be able to hold on, and when we should let go. When to accept and when to fight."
Psychonauts in the Rhombus of Ruin,71,15572,2017,Tout Public,NA,"['Puzzle', 'Adventure', 'Indie']",1,3,4,"['Science fiction', 'Comedy']",Yes,2073600,['Double Fine Productions'],['Double Fine Productions'],NA,Virtual Reality,"[11367, 25222, 25311, 25646, 26223, 27266, 28070, 55190, 105269, 106992]",NA,Psychonauts in the Rhombus of Ruin is a first-person virtual reality puzzle platform video game. The game's story is intended to bridge the events between Psychonauts and Psychonauts 2.,"At the end of Psychonauts, Raz is recognized as a great PSI Cadet and is asked to join his tutors as a fully fledged Psychonaut. But as Raz prepares to go home from camp with his father, news arrives that the Grand Head of the Psychonauts (and Lili's father) Truman Zanotto, has been kidnapped. The team, Raz and Lili included, fly off in the Psychonauts' jet to rescue him."
Ys Origin,82,10949,2006,Tout Public,NA,"['Platform', 'Role-playing (RPG)', 'Adventure']",0,10,5,"['Action', 'Fantasy']",Yes,2073600,"['XSEED Games', 'Nihon Falcom', 'DotEmu']",['Nihon Falcom'],NA,Third person,"[9938, 11646, 18182, 22387, 24426, 26855, 28168, 36198, 47823, 96217]",NA,"700 years before the events of Ys I & II, the land of Ys was on the brink of destruction. Demons came in droves and forced the twin Goddesses who ruled the land to whisk their subjects away from the surface, into the safe embrace of the clouds. The demons were persistent, however, erecting a massive tower in pursuit. The battle that raged upon the ground had begun ascending for a second round up above.
One day, amidst this turmoil, the Goddesses stole away into the night, vanishing from Ys altogether. And there's only one place they could have gone: the Devil's Tower.

A search party of knights and sorcerers was hastily formed and dispatched to the surface in hopes of retrieving these runaway deities. Among its members were apprentice knight Yunica Tovah and troubled sorcerer Hugo Fact.

This is their story. Or at least, it's how each of them remembers it.

Expanding upon the gameplay elements introduced in Ys: The Ark of Napishtim and further developed in Ys: The Oath in Felghana, Ys Origin perfects the formula by adding different styles of play and new features never before seen in the Ys universe. Best described as an arcade-like platformer RPG with Metroidvania elements and a complex, multi-faceted narrative, Ys Origin is the perfect mix of action, exploration and story. Screen-filling bosses with complex AI, unique platforming elements, innovative puzzles and a deeply involving mystery await within the wildly varied confines of this classic Ys dungeon.

Come see how long you can last in the Devil's Tower...","""Following a devastating demonic invasion, the twin Goddesses use their magic to bring the inhabitants of legendary Ys safely into the sky. While the demons work to construct Devil’s Tower and reach the humans’ new abode, the Goddesses disappear. As a mighty warrior or a cunning mage, you must seek the Goddesses in Devil’s Tower. With your swordsmanship and spells, can you banish evil from the land of your ancestors?"""
Hollow Knight,90,14593,2017,Tout Public,NA,"['Platform', 'Adventure', 'Indie']",3,31,5,"['Action', 'Fantasy']",Yes,4785400,['Team Cherry'],['Team Cherry'],NA,Side view,"[3222, 9806, 10388, 11646, 18182, 24426, 26820, 26855, 28070, 36198]",Unity,"A 2D metroidvania with an emphasis on close combat and exploration in which the player enters the once-prosperous now-bleak insect kingdom of Hallownest, travels through its various districts, meets friendly inhabitants, fights hostile ones and uncovers the kingdom's history while improving their combat abilities and movement arsenal by fighting bosses and accessing out-of-the-way areas.",
Horizon Zero Dawn,89,11156,2017,16 year,NA,"['Shooter', 'Role-playing (RPG)', 'Adventure']",95,0,2,"['Action', 'Science fiction', 'Stealth', 'Drama', 'Open world']",Yes,982800,['Sony Interactive Entertainment'],['Guerrilla Games'],NA,Third person,"[1877, 7331, 7346, 11208, 17379, 19560, 19564, 19565, 25076, 26192]",Decima,"Welcome to a vibrant world rich with the beauty of nature – but inhabited by awe-inspiring, highly advanced machines. As a young machine hunter named Aloy, you must unravel the mysteries of this world and find your own destiny.",
Story of Seasons: Trio of Towns,74,15910,2016,Tout Public,NA,"['Role-playing (RPG)', 'Simulator']",0,5,1,['Fantasy'],Yes,1280000,"['Marvelous', 'XSEED Games']",['Marvelous'],NA,Third person,"[19404, 36346, 43165, 55590, 96217, 99118, 106987, 111187, 112191, 115653]",NA,"The series is celebrating its 20th anniversary with a new game for the Nintendo 3DS. The title of the game is Bokujō Monogatari: Mitsu no Sato no Taisetsu na Tomodachi (Harvest Moon/Story of Seasons: Precious Friends From Three Villages).

The game will have at least three locales: Lulucoco Town, Tsuyukusa Village and Wes Town. The culture of each will be completely different. Lulucoco is an island settlement, Tsuyukusa is a Japanese village, and Wes Town is a western-style town.

The game will feature a protagonist - female or male - and the characters Noel, Miranda, Megan, and Frank from Wes Town.",
Torment: Tides of Numenera,81,2004,2017,16 year,NA,"['Role-playing (RPG)', 'Strategy', 'Turn-based strategy (TBS)', 'Adventure', 'Indie']",35,14,5,"['Fantasy', 'Science fiction']",Yes,810000,['Techland'],['inXile Entertainment'],NA,Bird view / Isometric,"[1593, 1887, 1942, 2365, 9179, 10388, 14394, 25311, 26845, 119171]",Unity,"Torment: Tides of Numenera is a game set in the world of Monte Cook's new tabletop RPG setting, Numenera. Torment continues the thematic legacy of Planescape: Torment, the critically acclaimed role-playing game from 1999 that's considered by many to be a hallmark for storytelling in computer RPGs. With Torment, we're creating a rich role-playing experience that explores similar deep, personal themes.","Numenera is set in the distant future, where the rise and fall of countless civilizations have left Earth in a roughly medieval state, with most of humanity living in simple settlements, surrounded by relics of the mysterious past. The current age is called the ""Ninth World"" by its scholars, who believe that eight great ages existed and were destroyed or disappeared for unknown reasons before their time, leaving ruins and various oddities and artifacts behind. These artifacts are known as the ""numenera"" and represent what is left of the science and technology of these past civilizations. Many of them are irreparably broken, but some are still able to function in ways that are beyond the level of understanding of most humans, who believe these objects to be magical in nature.

The protagonist of the story, known as the Last Castoff, is the final vessel for the consciousness of an ancient man, who managed to find a way to leave his physical body and be reborn in a new one, thus achieving a kind of immortality by means of the relics. Unknown to him, however, every time he abandoned – or ""cast off"" – these host bodies, they awoke with a consciousness of their own, having no memory of their former master or his deeds. The actions of this man, known as the Changing God to some, attracted the enmity of the ""Angel of Entropy"", who now seeks to destroy him and his creations. The Last Castoff, being one such ""creation"", is also targeted by the Angel, and must find their master before both are undone. To do so, the protagonist must explore the Ninth World, discovering other castoffs, making friends and enemies along the way. One means of such exploration are the ""Meres"" – artifacts that let their user gain control over the lives of other castoffs, and experience different worlds or dimensions through them. Through these travels the Last Castoff will leave their mark on the world – their Legacy – and will find an answer to the fundamental question of the story: What does one life matter?"
Robo Recall,85,26451,2017,NA,NA,"['Shooter', 'Arcade']",1,0,3,"['Action', 'Science fiction']",Yes,NA,[],['Epic Games'],NA,First person,"[43367, 55038, 57187, 68286, 68287, 103301, 105269, 107318, 111846, 113362]",Unreal Engine,"Use creative combat tactics and skill shots to earn high scores as you teleport through city streets and rooftops in an awe-inspiring ballet of bullets. Tear apart your robot foes and use them to fend off the enemy onslaught. Unlock, customize and test weapons before taking on challenges that put your newfound skills to the test!","An eruption of defective, homicidal robots is inundating RoboReady customer service, where you’ve been promoted from tech repairman to Recaller. Thrown into the fray, you must rely on your wits, reflexes and a vast arsenal of weaponry to eliminate the robot uprising."
Winning Post 8 2017,N/A,54566,2017,Tout Public,NA,"['Racing', 'Sport']",0,0,5,[],Yes,NA,['Koei Tecmo Games'],['Koei Tecmo Games'],NA,Third person,"[80382, 109292, 109606, 113105, 116352, 116353, 116667, 117855, 118871, 120126]",NA,,
1-2-Switch,58,26762,2017,Tout Public,NA,['Arcade'],1,8,1,"['Action', 'Party']",Yes,2073600,['Nintendo'],"['Nintendo EPD', 'Nintendo']",No,Text,"[15851, 27419, 27927, 28113, 31194, 43367, 54774, 56033, 89025, 119207]",NA,"1-2-Switch is a party game for everyone! Throw an impromptu party anywhere with anyone thanks to a new play style in which players look at each other—not the screen! Bring the action and fun into the real world as you face off in wild-west duels, cow-milking competitions, and more. While the action unfolds off-screen, the audience watches the players themselves instead of the screen.",
Human Resource Machine,78,14545,2015,Tout Public,NA,"['Puzzle', 'Simulator', 'Strategy', 'Indie']",0,39,7,"['Comedy', 'Educational']",Yes,2073600,"['Tomorrow Corporation', 'Experimental Gameplay Group']",['Tomorrow Corporation'],NA,Bird view / Isometric,"[17111, 17130, 17519, 29173, 31515, 36346, 55590, 55689, 65827, 79134]",NA,"""Human Resource Machine is a puzzle game. In each level, your boss gives you a job. Automate it by programming your little office worker! If you succeed, you'll be promoted up to the next level for another year of work in the vast office building. Congratulations!

Don't worry if you've never programmed before - programming is just puzzle solving. If you strip away all the 1's and 0's and scary squiggly brackets, programming is actually simple, logical, beautiful, and something that anyone can understand and have fun with!""",
I Am Setsuna,74,18861,2016,Tout Public,NA,"['Role-playing (RPG)', 'Adventure']",1,6,4,"['Fantasy', 'Drama']",Yes,1000000,['Square Enix'],['Tokyo RPG Factory'],NA,Bird view / Isometric,"[3222, 8746, 9938, 10388, 11646, 18182, 22387, 24426, 25921, 36198]",Unity,"I Am Setsuna introduces the authentic JRPG style of yesteryear to PlayStation4 and Steam! Journey with Setsuna as she prepares to make the ultimate sacrifice and save the people of her land. A powerfully nostalgic experience, blending a classic style of story-telling, battle system and gameplay.","""The island had a custom.
To maintain peace, once a decade, a sacrifice was offered to a fiend on the island. However, one year, the fiend grew violent before the next sacrifice was due. Those living on the island were afraid and tried to calm the fiend by offering a sacrifice; Setsuna, chosen because of her powers of enchantment. Setsuna must leave with her safeguards for the farthest land, where the ceremony of sacrifice will be held."""
Just Dance 2017,72,19550,2016,Tout Public,NA,['Music'],3,29,8,"['Comedy', 'Party']",Yes,NA,['Ubisoft Entertainment'],"['Ubisoft Paris', 'Ubisoft Milan', 'Ubisoft Pune']",Yes,Side view,"[11423, 18981, 19082, 20329, 28113, 63933, 77720, 82275, 86316, 103315]",NA,"Grab your friends and family: it’s time to dance! Just Dance is back with over 40 new tracks, 6 games modes, and ever more songs through Just Dance Unlimited subscription service! Featuring the ultimate tracklist including Cheap Thrills by Sia Ft. Sean Paul, Sorry by Justin Bieber and many more!",
Little Inferno,79,1363,2012,Tout Public,NA,"['Puzzle', 'Simulator', 'Adventure', 'Indie']",0,18,7,"['Action', 'Comedy', 'Sandbox']",Yes,2073600,"['Experimental Gameplay', 'Tomorrow Corporation']",['Tomorrow Corporation'],NA,Side view,"[3277, 16992, 17379, 26574, 33153, 35994, 55173, 55190, 56033, 105011]",NA,"Congratulations on your new Little Inferno Entertainment Fireplace! Throw your toys into your fire, and play with them as they burn. Stay warm in there. It's getting cold outside! Burn flaming logs, screaming robots, credit cards, batteries, exploding fish, unstable nuclear devices, and tiny galaxies. An adventure that takes place almost entirely in front of a fireplace - about looking up up up out of the chimney, and the cold world just on the other side of the wall.",
Skylanders: Imaginators,79,19576,2016,Tout Public,NA,"['Platform', 'Adventure']",0,0,6,"['Action', 'Fantasy', 'Kids']",Yes,NA,['Activision'],['Toys for Bob'],Yes,Third person,"[19150, 19560, 24426, 28070, 29032, 55038, 55199, 96217, 105049, 106987]",NA,"Kaos has discovered the ancient power of Mind Magic and is using it to create an unstoppable army of Doomlanders! Eon is calling upon all Portal Masters and Skylands' greatest mystic warriors, the Senseis, to stop Kaos and his minions. Now, you must use the power of your imagination to create your own Skylanders to battle in the ultimate adventure alongside the almighty Senseis to save Skylands.

Now with Skylanders Imaginators on the Nintendo Switch, Embark on an Epic New Adventure on-the-go
Use the Digital Library for easy on-the-go access to your Skylanders toy collection
Use the Imaginite Creation Crystals to Create Your Own Skylanders
Sensei Skylanders are the Ultimate Masters of the Almighty Sky-Chi Powers
Battle to Save Skylands with the Sensei and Imaginator Skylanders
Use 10 Different Battle Class Types to Defeat Kaos and his Minions
Conquer All-New Side quests & Mini-games","Kaos has discovered the ancient power of Mind Magic and is using it to create an unstoppable army of Doomlanders! Eon is calling upon all Portal Masters and Skylands' greatest mystic warriors, the Senseis to stop Kaos and his minions. Now, you must use the power of your imagination to create your own Skylanders to battle in the ultimate adventure alongside the almighty Senseis to save Skylands."
Super Bomberman R,62,26760,2017,Tout Public,NA,"['Puzzle', 'Strategy', 'Arcade']",1,28,4,"['Action', 'Party']",Yes,2073600,['Konami'],['Konami'],Yes,Bird view / Isometric,"[25640, 25646, 25905, 27419, 56033, 78550, 90788, 95340, 110503, 119207]",NA,"""Since its release in 1985, Bomberman has been a familiar party-battle game for many years. Now, Bomberman is coming back as ""SUPER BOMBERMAN R"" to Nintendo Switch.

In SUPER BOMBERMAN R, the simple rule remains the same: operate the main character (Bomberman), place bombs, and battle with enemies and rivals, but it's coming back in a modern style with 3D stages and photo-real graphics. You can enjoy battles with rivals from all over the world.

There is ""Battle"" mode for maximum of 8 players, and single play ""Story"" mode (cooperative play for 2 players is possible as well) where players clear each stage one by one, with a big volume of 50 stages. Also, there is a new rule where the condition to clear the stage is not just by wiping out all the enemies. This simple but strategic game with new rules and 3D stages is fun for everyone, from children to adults.""",
The Legend of Zelda: Breath of the Wild,97,7346,2017,Tout Public,NA,"['Puzzle', 'Role-playing (RPG)', 'Adventure']",142,11,2,"['Action', 'Fantasy', 'Science fiction', 'Survival', 'Drama', 'Sandbox', 'Open world']",Yes,1540000,['Nintendo'],['Nintendo EPD Production Group No. 3'],NA,Third person,"[359, 1036, 1942, 3025, 7331, 11156, 19560, 19564, 25076, 26758]",Havok Physics,"The Legend of Zelda: Breath of the Wild is the first 3D open-world game in the Zelda series. Link can travel anywhere and be equipped with weapons and armor found throughout the world to grant him various bonuses. Unlike many games in the series, Breath of the Wild does not impose a specific order in which quests or dungeons must be completed. While the game still has environmental obstacles such as weather effects, inhospitable lands, or powerful enemies, many of them can be overcome using the right method. A lot of critics ranked Breath of the Wild as one of the best video games of all time.","Link is awakened in a room by a voice calling him and learns that he has been asleep for 100 years after failing to stop a monster called Calamity Ganon. Although the monster is being held in Hyrule Castle by Princess Zelda, Calamity Ganon's power continues to grow and if not stopped he will eventually break free with enough power to destroy the entire world. Link embarks on his quest to defeat Calamity Ganon and save Hyrule and Zelda."
World of Goo,90,942,2008,Tout Public,NA,"['Puzzle', 'Simulator', 'Strategy', 'Indie']",0,18,8,"['Comedy', 'Sandbox']",Yes,2073600,"['Brighter Minds', '2D Boy', 'Microsoft Studios', 'Tomorrow Corporation']",['2D Boy'],No,Side view,"[9278, 14951, 16992, 18167, 18433, 19082, 26574, 28113, 33153, 44242]",NA,"World of Goo is a multiple award winning physics based puzzle / construction game made entirely by two guys. Drag and drop living, squirming, talking, globs of goo to build structures, bridges, cannonballs, zeppelins, and giant tongues. The millions of Goo Balls that live in the beautiful World of Goo are curious to explore - but they don't know that they are in a game, or that they are extremely delicious. Congratulations, and good luck!","Initially, pipes appear throughout the land, waking up many sleeping Goo Balls who have gone undisturbed until this, as they are filled with a childlike sense of curiosity and naivety they build themselves towards the pipes. Upon reaching the pipe entrance, the Goo Balls are sucked by the pipe system into the ""World of Goo Corporation"" main building where they are processed into many products, for example an energy drink. The excess Goo Balls are left outside the Corporation headquarters where they together begin to build a giant tower. At the end of the first chapter, some Goo Balls escape from a Corporation building by attaching themselves to eyeballs which have the ability to fly. The chapter ends with the Goo Balls ""seeing far away new lands""."
Atelier Firis: The Alchemist and the Mysterious Journey,74,25921,2016,Tout Public,NA,"['Role-playing (RPG)', 'Strategy', 'Adventure']",0,6,3,"['Fantasy', 'Business']",Yes,NA,"['Koei Tecmo Games', 'Koei Tecmo America Corporation', 'Koei Tecmo Europe']",['Gust'],NA,Third person,"[19404, 24426, 27092, 28010, 55199, 96217, 103334, 106987, 115653, 119061]",NA,"The second entry in the 'Mysterious' saga follows the adventures of the enthusiastic Firis Mistlud and her loving older sister Liane Mistlud. The sisters have lived their entire lives in the isolated town of Ertona, where Firis uses her unique ability to see where crystals of materials are buried.",
