Title,Note,Id,Date de Sortie,Age Rating,Franchise,Genres,Hypes,nb_languages,nb_platforms,Themes,Collection,Graphismes,Publisher,Developer,Multiplayer,Perspective,Similar Games,Game Engine,Summary,Storyline
Moss,85,37095,2018,Tout Public,NA,"['Platform', 'Puzzle', 'Adventure']",2,24,6,['Action'],Yes,1190400,['Polyarc Games'],['Polyarc Games'],NA,Virtual Reality,"[20329, 20342, 24426, 25646, 28070, 36198, 55173, 55190, 56033, 80916]",NA,"In Moss, players can reach out, touch, and interact with the environment while guiding Quill through her journey. As a character within the world, players will work together with Quill to solve puzzles, overcome obstacles, and conquer any danger that comes their way,” said Danny Bulla, co-founder and design director of Polyarc. “As gamers, we’ve been conditioned for years to hold a gamepad in our laps when playing games, letting our thumbs and fingers do the controlling. It has been a great experience to create an immersive game that encourages players to reach into and interact with a tactile world.","Meet Quill, a young mouse with dreams of greatness beyond the confines of her quiet settlement. One day while exploring the woods, she finds a mysterious stone and an ancient magic is awakened. Dramatic events quickly unfold as a distant evil extends its reach. With her uncle now in grave danger, Quill must embark on an epic journey—and she needs you there by her side. Together, you'll travel to forgotten realms, solve challenging puzzles, and battle menacing enemies. Alone, no one can conquer what you're up against. But united, you just may defeat even the darkest of villains. Immerse yourself in the world of Moss to help write the story of a hero in the making."
Outlast,80,1910,2013,18 year,NA,"['Adventure', 'Indie']",0,10,6,"['Action', 'Horror', 'Survival', 'Stealth', 'Mystery']",Yes,2073600,['Red Barrels'],['Red Barrels'],NA,First person,"[533, 1882, 2031, 2939, 3042, 3188, 5647, 7342, 9727, 19531]",Unreal Engine 3,"Hell is an experiment you can't survive in Outlast, a first-person survival horror game developed by veterans of some of the biggest game franchises in history. As investigative journalist Miles Upshur, explore Mount Massive Asylum and try to survive long enough to discover its terrible secret... if you dare.","In the remote mountains of Colorado, horrors wait inside Mount Massive Asylum. A long-abandoned home for the mentally ill, recently re-opened by the “research and charity” branch of the transnational Murkoff Corporation, the asylum has been operating in strict secrecy… until now.

Acting on a tip from an anonymous source, independent journalist Miles Upshur breaks into the facility, and what he discovers walks a terrifying line between science and religion, nature and something else entirely. Once inside, his only hope of escape lies with the terrible truth at the heart of Mount Massive.

Outlast is a true survival horror experience which aims to show that the most terrifying monsters of all come from the human mind."
Payday 2,79,2058,2013,18 year,NA,"['Shooter', 'Role-playing (RPG)', 'Tactical']",0,22,7,"['Action', 'Stealth']",Yes,2073600,"['505 Games', 'Starbreeze Studios']",['Overkill Software'],Yes,First person,"[3277, 5647, 9938, 10964, 11646, 15536, 22387, 27270, 27419, 105049]",Diesel,"Payday 2 is an action-packed, four-player co-op shooter that once again lets gamers don the masks of the original crew: Dallas, Hoxton, Wolf and Chains as they descend on Washington D.C. for an epic crime spree.",
Darkest Dungeon,84,8965,2015,16 year,NA,"['Role-playing (RPG)', 'Strategy', 'Turn-based strategy (TBS)', 'Adventure', 'Indie']",4,31,8,"['Fantasy', 'Horror', 'Historical']",Yes,2073600,['Red Hook Studios'],['Red Hook Studios'],NA,Side view,"[1593, 3222, 9278, 10388, 11800, 14394, 19150, 20331, 22387, 36198]",Custom built engine,"Darkest Dungeon is a challenging gothic roguelike turn-based RPG about the psychological stresses of adventuring. Recruit, train, and lead a team of flawed heroes against unimaginable horrors, stress, disease, and the ever-encroaching dark. Can you keep your heroes together when all hope is lost?",
H1Z1,66,6188,2015,16 year,NA,"['Shooter', 'Adventure']",12,0,2,"['Horror', 'Survival', 'Open world']",Yes,NA,['Sony Online Entertainment'],['Sony Online Entertainment'],NA,First person,"[13210, 17379, 18225, 19561, 26574, 26658, 44076, 102584, 111130, 120201]",Forgelight Engine,"Offering a total sandbox experience, H1Z1 is a zombie survival MMO set in a post-apocalyptic world where thousands of players must strategically align with friends and against enemies in order to survive the worldwide infection.

Daybreak Games announced in early 2016 that H1Z1 has been split into two games: H1Z1: King of the Kill & H1Z1: Just Survive.",
Pit People,78,17207,2018,16 year,NA,"['Role-playing (RPG)', 'Simulator', 'Strategy', 'Turn-based strategy (TBS)', 'Adventure', 'Indie']",4,23,2,"['Action', 'Comedy', 'Warfare']",Yes,2073600,['The Behemoth'],['The Behemoth'],Yes,Bird view / Isometric,"[3222, 18869, 19301, 21564, 25311, 26574, 28182, 35994, 36198, 55190]",NA,"In the fast-paced, turn-based, co-op adventure you'll quest and explore, find awesome loot, customize your fighters, and recruit strange species. Rally your troops and steel your wits if you hope to survive a hostile world filled with sinister robots, deadly vampires and brutally adorable cupcake people!",
Bravo Team,45,37143,2018,Tout Public,NA,['Shooter'],1,0,2,['Action'],Yes,8294400,['Sony Interactive Entertainment'],['Supermassive Games'],NA,First person,"[19164, 22387, 28552, 38030, 76263, 95340, 103292, 103301, 106805, 119177]",Unreal Engine 4,"Take aim. Strike first – strike hard. It’s all or nothing in a heart-pumping firefight of intense combat and split-second tactical decision making.

Trapped in hostile territory, you and your teammate are totally surrounded. Only cool thinking in the heat of battle will see you through to the end of your mission – so take up variety of shotguns, pistols and automatic weapons, duck into cover and make every shot count.

Fully compatible with the PlayStation aim controller. Make sure you have the edge in this gritty, guerrilla warfare, with a PlayStation aim controller. With precision tracking technology for deadly accuracy and vibration feedback for total immersion, you’ll feel every shot.",
DJMax Respect,85,28192,2017,Tout Public,NA,['Music'],0,4,1,"['Action', 'Party']",Yes,2073600,"['Sony Interactive Entertainment', 'NEOWIZ']",['Rocky Studio'],No,Side view,"[4052, 11711, 18981, 28010, 57296, 57372, 63793, 63933, 77720, 78969]",NA,DJMax Respect is a rhythm game and a reboot of the latest installment in the DJMax rhythm game series.,
Fear Effect Sedna,50,30847,2018,16 year,NA,"['Shooter', 'Puzzle', 'Role-playing (RPG)', 'Strategy', 'Tactical', 'Adventure']",1,7,4,"['Action', 'Fantasy', 'Science fiction']",Yes,2073600,"['Forever Entertainment S. A.', 'Square Enix']",['Sushee'],NA,Bird view / Isometric,"[1877, 24426, 25311, 27092, 36198, 47823, 55038, 89597, 105049, 105269]",Unity,"""Fear Effect Sedna is a pausable real-time tactical action game. Become reacquainted with the old team of Hana, Rain, Deke & Glas in a brand new adventure. From Hong Kong to Greenland, through Inuit mythology and with new partners, will you dare to face the spirit world once again?""","""Things have changed for the team. Hana, freed from the Triad, lives with Rain in Hong Kong and works as an occasional mercenary, while Deke has grown apart from them since Glas returned to the US.

Hana accepts a small mission for a shadowy organization asking for her services. Her target: a mysterious ancient statuette held by the ambassador of China in France. She sees it as a good opportunity to visit her birthplace... But this 'easy' mission is about to lead Hana to something bigger than expected. Meanwhile Glas is approached by a client who catches his attention and piques his interest, enough that Glas sets out for Greenland."""
Final Fantasy XV: Windows Edition,85,55034,2018,Tout Public,NA,"['Role-playing (RPG)', ""Hack and slash/Beat 'em up"", 'Adventure']",1,27,1,"['Action', 'Fantasy', 'Science fiction', 'Survival', 'Sandbox', 'Warfare']",Yes,1018800,['Square Enix'],['Square Enix'],NA,Third person,"[17548, 26574, 54775, 55038, 55199, 96217, 103168, 106987, 113360, 114009]",Luminous Studio,"Get ready to be at the centre of the ultimate fantasy adventure, now for Windows PC.

Joined by your closest friends on the roadtrip of a lifetime through a breathtaking open world, witness stunning landscapes and encounter larger-than-life beasts on your journey to reclaim your homeland from an unimaginable foe.

In an action-packed battle system, channel the power of your ancestors to warp effortlessly through the air in thrilling combat, and together with your comrades, master the skills of weaponry, magic and team-based attacks.

Now realised with the power of cutting-edge technology for Windows PCs, including support for high-resolution displays and HDR10, the beautiful and carefully-crafted experience of FINAL FANTASY XV can be explored like never before.","""Enroute to wed his fiancée Luna on a road trip with his best friends, Prince Noctis is advised by news reports that his homeland has been invaded and taken over under the false pretense of a peace treaty – and that he, his loved one and his father King Regis, have been slain at the hands of the enemy.

To gather the strength needed to uncover the truth and reclaim his homeland, Noctis and his loyal companions must overcome a series of challenges in a spectacular open world - that is filled with larger-than-life creatures, amazing wonders, diverse cultures and treacherous foes."""
Frantics,68,69348,2018,Tout Public,NA,"['Fighting', 'Racing', 'Tactical', 'Arcade']",0,0,1,['Party'],Yes,144000000,['Sony Interactive Entertainment'],['NapNok Games'],NA,Third person,"[27378, 27419, 27927, 28113, 54774, 103018, 103369, 115563, 119207, 120795]",NA,Game for PlayStation 4.,
Scribblenauts Showdown,47,78754,2018,Tout Public,NA,"['Music', 'Puzzle', 'Sport']",0,7,3,"['Action', 'Sandbox', 'Party']",Yes,2073600,['Warner Bros. Interactive Entertainment'],['Shiver Entertainment'],No,Side view,"[25646, 37419, 55190, 60044, 63933, 83731, 95225, 113360, 118871, 119422]",NA,"It’s Scribblenauts, party-style! Use your imagination and go head-to-head in the ultimate multiplayer showdown! Enjoy a party-style Scribblenauts experience, conjuring from over 35,000 objects from the vast Scribblenauts dictionary to outsmart your opponent in over 25 mini-games.",
Way of the Passive Fist,68,36780,2018,16 year,NA,"['Fighting', ""Hack and slash/Beat 'em up"", 'Indie', 'Arcade']",1,14,6,"['Action', 'Comedy']",Yes,2073600,['Household Games'],['Household Games'],NA,Side view,"[18869, 20329, 21642, 22387, 27419, 36198, 43367, 55190, 56033, 90011]",NA,"Way of the Passive Fist is a unique and colorful arcade brawler. Parry, Dodge and Dash to outwit and outlast your enemies on a desolate planet ruled by raiders, mutants and fanatical sun worshipers. It's a new kind of tactical fighting in the licensed arcade brawler for the 90s cartoon you wish existed.",
Damascus Gear: Operation Osaka,N/A,123034,2017,Tout Public,NA,['Role-playing (RPG)'],0,2,3,['Action'],Yes,2073600,['Arc System Works'],"['APLUS Co., Ltd.', 'Arc System Works']",NA,Bird view / Isometric,"[25636, 54775, 55199, 57372, 96217, 106987, 111835, 113109, 113636, 115280]",NA,"The goal of 'Damascus Gear Operation Osaka' is to repay the hero's inherited debt before the due date. The hero together with his Operator will participate in the Arena as a Ranker, aiming for the prize money to repay his debt. It will not be a story for the history books, but a battle for freedom...","'GEAR System' - The system revealed by Atsuga Corporation in the mid-21st century revolutionized all technologies, allowing for the perfection of piloted humanoid robots called 'GEARs'. 
 
During World War IV in 2050, GEARs from all over the world went berserk and began massacring humanity. The berserk GEARs, known as 'RAGE', conquered the surface world and pushed humanity to the brink of extinction. The remaining survivors escaped underground and began their counterattack. After over 50 years of war, humanity managed to defeat the RAGEs and reclaim Japan. 30 years later in the 'Cosmopolis' built upon Osaka, GEAR pilots fight day and night in the 'Arena' for large sums of 'Eyn'."
Chuchel,81,57263,2018,Tout Public,NA,"['Point-and-click', 'Puzzle', 'Adventure', 'Indie']",3,52,4,"['Comedy', 'Kids']",Yes,1190400,['Amanita Design'],['Amanita Design'],NA,Side view,"[236, 11367, 13189, 18011, 25222, 25646, 27266, 27725, 81275, 106992]",NA,"CHUCHEL is a comedy adventure game from the creators of Machinarium, Botanicula and Samorost. Help Chuchel to chase down the mysterious villain and retrieve his cherished cherry! The reward? A hearty situational humor, wild music and hilarious animations that warm up even the coldest of souls","The game follows the protagonist Chuchel as he tries to retrieve a cherry stolen by a giant Chrchel one early morning. His all-in-one best friend, enemy and pet Kekel is there to help him on the way."
Northgard,81,18918,2018,Tout Public,NA,"['Real Time Strategy (RTS)', 'Role-playing (RPG)', 'Simulator', 'Strategy', 'Turn-based strategy (TBS)', 'Indie']",3,26,7,"['Fantasy', 'Survival']",Yes,8294400,['Shiro Games'],['Shiro Games'],NA,Bird view / Isometric,"[9472, 9789, 13196, 17130, 19404, 25311, 26145, 26574, 33153, 109339]",Heaps.io,"Northgard is a strategy game based on Norse mythology in which you control a clan of Vikings vying for the control of a mysterious newfound continent.

- Build your settlement on the newly discovered continent of Northgard

- Assign your vikings to various jobs (Farmer, Warrior, Sailor, Loremaster...)

- Manage your resources carefully and survive harsh winters and vicious foes

- Expand and discover new territory with unique strategic opportunities

- Achieve different victory conditions (Conquest, Fame, Lore, Trading...)

- Play against your friends or against an AI with different difficulty levels and personalities

- Enjoy dedicated servers and grind the ranks to reach the final Norse God rank!","After years of tireless explorations, brave Vikings have discovered a new land filled with mystery, danger and riches: Northgard.

The boldest Northmen have set sail to explore and conquer these new shores, bring fame to their Clan and write history through conquest, trading, or devotion to the Gods.

That is, if they can survive the dire wolves and undead warriors roaming the land, befriend or defeat the giants, and survive the harshest winters ever witnessed in the North."
Warhammer: Vermintide 2,82,55189,2018,18 year,NA,"['Shooter', 'Role-playing (RPG)', 'Adventure', 'Indie']",2,19,3,['Action'],Yes,8294400,['Fatshark'],['Fatshark'],Yes,First person,"[28309, 35994, 47823, 55038, 80916, 96217, 105049, 105269, 106987, 107318]",NA,Warhammer: Vermintide 2 is the sequel to the critically acclaimed Vermintide. It's time for players to return to the memorable first-person co-op experience with intense world class melee action.,
Flinthook,76,20330,2017,Tout Public,NA,"['Shooter', 'Platform', 'Adventure', 'Indie', 'Arcade']",1,6,6,"['Action', 'Science fiction']",Yes,2073600,['Tribute Games'],['Tribute Games'],NA,Side view,"[3222, 18869, 19301, 20342, 28070, 36198, 55190, 56033, 105269, 107318]",NA,"Flinthook is a fast action-platformer with “roguelike” elements. Become space’s greatest pirate with your hookshot, pistol and slowmo powers!","In a galaxy filled with scoundrels and miscreants, everyone seeks treasure and riches! But when a malevolent treasure hunter hatches a sinister plan to unleash an ancient evil to threaten the cosmos itself, Flinthook, the galaxy's smallest but toughest pirate zips into action! Be ready to jump, zip and blast around the meanest fleets the galaxy has to offer! Whether using time-slowing powers or his trusty Blasma Pistol, Flinthook is ready to take on all pirates, steal treasure and save the galaxy itself!"
Devil May Cry HD Collection,77,20734,2012,16 year,NA,"['Platform', ""Hack and slash/Beat 'em up""]",1,17,5,"['Action', 'Fantasy', 'Horror']",Yes,2073600,['Capcom'],['Capcom Production Studio 4'],NA,Third person,"[112, 135, 136, 549, 551, 571, 1006, 1244, 2031, 5181]",NA,"The popular stylish action games Devil May Cry, Devil May Cry 2, and Devil May Cry 3 Special Edition return in one collection!

As Dante, the ultimate devil hunter, you'll join forces with appealing characters such as Trish, Lady, and Lucia to enjoy the iconic genre-defining Devil May Cry series in stunning High Definition.",
Ghost of a Tale,75,7684,2018,16 year,NA,"['Puzzle', 'Role-playing (RPG)', 'Adventure', 'Indie']",1,14,5,"['Action', 'Fantasy', 'Stealth']",Yes,2073600,"['SeithCG', 'Plug In Digital']","['SeithCG', 'SeithCG']",NA,Third person,"[22387, 24426, 28309, 36198, 47823, 55190, 80916, 96217, 106987, 113360]",Unity,"Ghost of a Tale is an action-RPG game in which you play as Tilo, a mouse and minstrel thrown into a perilous adventure. Through stealth and cunning you’ll be able to explore the secrets of Dwindling Heights Keep and navigate its dangers.","Ghost of a Tale takes place in a medieval world inhabited by several species of anthropomorphic animals, many of which inhabit their own kingdom: the lore includes mice, rats, frogs, crabs, badgers, hawks, spiders, leeches, magpies and various undead creatures.

The game is set centuries after a cataclysmic event known as the War of the Green Flame. During this time, a mysterious ball of emerald fire of unknown origin swept across the world, killing all who stood against it and raising their bodies into an ever-growing undead army. At the height of the conflict, the mouse kingdom sent an envoy to the flame attempting to save their home by revealing the weaknesses of others, but the being could not be reasoned with and destroyed most of their land regardless.

In the end, it was the rat army who rose up to finally defeat the entity, becoming the heroes of the war, and expelled the mice from the land's governing body forever for their treachery. Hundreds of years later, the exact history of these events has become clouded in time, with the only true account being held in the oral traditions of a group of magpies called the Truth Sayers, who live in a tower on an ancient island.

At the beginning of the game, Tilo mouse is thrown into a dungeon by rats: he must escape from his prison and the surrounding lands. The many adversaries Tilo faces are much stronger than him: the courageous little mouse will need to be smart, stealthy and agile to succeed!"
Q.U.B.E. 2,76,36766,2018,Tout Public,NA,"['Platform', 'Puzzle', 'Adventure', 'Indie']",1,20,4,"['Action', 'Science fiction', 'Mystery']",Yes,147456,['Toxic Games'],['Toxic Games'],NA,First person,"[20329, 20342, 24426, 25646, 28070, 36198, 54678, 55173, 55190, 56033]",NA,"Q.U.B.E. 2 is the sequel to the hit first-person puzzle game Q.U.B.E. You are Amelia Cross, a stranded archaeologist who has awoken among the ruins of an ancient alien landscape. With the distant help of another survivor you must manipulate the structure of this mysterious world and find a way back home.",
Gal Gunvolt Burst,N/A,92038,2018,Tout Public,NA,"['Shooter', 'Platform']",0,0,1,['Action'],Yes,2073600,['Inti Creates'],['Inti Creates'],NA,Side view,"[12539, 19164, 38030, 55042, 57187, 76263, 95340, 103292, 106805, 119177]",NA,Take on brand-new 2D side-scrolling action with a 'Burst Combo!' Enter a virtual world of cyber-landscapes and unravel the mystery behind its creation!,
Shin Hayarigami,N/A,79331,2014,NA,NA,"['Simulator', 'Adventure', 'Visual Novel']",0,0,2,"['Horror', 'Thriller', 'Mystery']",Yes,NA,"['Nippon Ichi Software', 'Intragames']",['Nippon Ichi Software'],NA,Side view,"[12328, 12579, 18011, 26148, 55047, 55984, 79994, 107614, 114150, 116530]",NA,"Shin Hayarigami was made to be a fresh start while being a continuation of the Hayarigami trilogy.

The game is a violent detective visual novel where recent murder victims match the story of an urban legend in the area. 6 cases that may or may not be linked are investigated throughout the story.
It was released by Nippon Ichi Software in 2014 for the PlayStaion 3 and Vita. The game got the CERO Z rating in Japan for it's disturbing visuals and story, Equivalent to an AO, sometimes M, rating in North America.

The game was also released on mobile devices in a split-up format in South Korea. The story was split into 6 separate games that covered the various cases from the original game.
In 2018 the first mobile game was translated and released in English but was not well received and the other 5 were put on hold and not planned for release as of 2019.",
Surviving Mars,76,28574,2018,16 year,NA,"['Simulator', 'Strategy']",8,19,5,"['Science fiction', 'Survival']",Yes,64000000,['Paradox Interactive'],['Haemimont Games'],NA,Bird view / Isometric,"[13200, 17111, 17130, 17613, 24620, 25311, 34823, 102057, 109339, 111187]",NA,"Surviving Mars is a sci-fi city builder all about colonizing Mars and surviving the process. Choose a space agency for resources and financial support before determining a location for your colony. Build domes and infrastructure, research new possibilities and utilize drones to unlock more elaborate ways to shape and expand your settlement. Cultivate your own food, mine minerals or just relax by the bar after a hard day’s work. Most important of all, though, is keeping your colonists alive. Not an easy task on a strange new planet.",
Burnout Paradise Remastered,82,78153,2018,Tout Public,NA,"['Racing', 'Adventure']",2,18,4,"['Action', 'Open world']",Yes,2073600,['Electronic Arts'],"['Criterion Games', 'Stellar Entertainment']",No,Third person,"[26574, 27092, 54842, 81249, 82090, 103303, 105011, 115653, 115785, 119161]",RenderWare,"Welcome back to Paradise City! Make action your middle name as you rule the streets in Burnout Paradise Remastered.
Tear up the town from hectic downtown avenues to wild mountain roads.
Relive the high-octane stunts and wanton destruction of one of the greatest arcade-driving games ever!

Burnout Paradise Remastered provides the ultimate driving playground for you and your friends to play online.
This remaster includes the 8 main DLC packs from the Year of Paradise, including the Big Surf Island update, meticulously recreated and ready to wreck!",
Kirby Star Allies,73,37137,2018,Tout Public,NA,"['Platform', ""Hack and slash/Beat 'em up"", 'Adventure']",5,10,1,['Action'],Yes,1280000,"['Nintendo', 'Nintendo of America', 'Nintendo of Europe']",['HAL Laboratory'],Yes,Side view,"[20342, 24426, 28070, 37001, 55173, 55190, 56033, 76253, 103168, 115283]",NA,"Kirby is back in this new title coming to the Nintendo Switch console in HD. Recruit enemies as helpers, use Kirby copy abilities such as Sword, Fire and Water, and join forces with up to three friends for a different kind of team-up action.",
Assassin's Creed Rogue: Remastered,71,81205,2018,18 year,NA,['Adventure'],1,0,3,"['Action', 'Historical', 'Stealth', 'Open world']",Yes,2073600,['Ubisoft Entertainment'],['Ubisoft Sofia'],NA,Third person,"[1877, 19564, 26574, 34155, 81249, 103054, 103303, 111130, 115653, 118218]",NA,"In addition to running in 4K, Assassin's Creed Rogue Remastered sports higher-resolution textures and shadows, improved environmental rendering, and new visual effects, making its sprawling wilderness, Arctic icescapes, and bustling version of New York City more striking than ever. The new edition also packs in all of the original's downloadable content and expansions, including two bonus missions – The Armor of Sir Gunn and The Siege of Fort de Sable – as well as the weapons, outfits, and customization items in the Master Templar and Explorer packs. It also includes a new bonus: Bayek's legacy outfit from Assassin's Creed Origins.",
Assault Gunners HD Edition,45,87854,2018,Tout Public,NA,"['Shooter', 'Simulator', 'Adventure', 'Arcade']",0,11,3,"['Action', 'Science fiction']",Yes,2073600,['Marvelous'],['Shade'],NA,Third person,"[1877, 25311, 43367, 55038, 76263, 103292, 103301, 105269, 106805, 107318]",NA,"""ASSAULT GUNNERS HD EDITION puts you in control of the Peace Keeping Force known as DAT and along with your three allied Battle Mechs, you must attempt to save Earth’s Migrants and the Mars Colonies as a whole from the threat of the ANTS uprising. Who or what could be leading this threat against Mars, and the new planned perfect utopia for humanity?

With 35 full-length battle-heavy missions, a horde gameplay mode known as “Inferno Mode” covering 5 varied maps and over 100 mech-customisation possibilities for yourself and your allies, there’s plenty of replayability and content present in the standalone version of ASSAULT GUNNERS HD EDITION.""","""It’s the Year 208X, Mars is in the process of terraformation with an expected timeline of 300 years till completion. Back on Earth a great war erupts and millions of migrants look to Mars to flee their home. The Planet Remodelling Project is accelerated with the aid of ANTS, a completely robotic automated system. Migrants build large dome-shaped colonies in regions with now stable climates and rush to construct cities within them to sustain the flow of refugees. Time passes and the World Federation has set up military colonies on Deimos and Phobos, and the dwarf-planet Ceres is being moved to Mars’ orbit to help create an ocean for the planet. One day, communication is suddenly lost with the surface of Mars, a peace keeping force called DAT whom are currently training on Deimos are sent to investigate..."""
