Title,Note,Id,Date de Sortie,Age Rating,Franchise,Genres,Hypes,nb_languages,nb_platforms,Themes,Collection,Graphismes,Publisher,Developer,Multiplayer,Perspective,Similar Games,Game Engine,Summary,Storyline
Muv-Luv Alternative,83,11781,2006,16 year,NA,['Visual Novel'],0,7,4,"['Science fiction', 'Drama', 'Warfare', 'Romance']",Yes,NA,"['âge', '5pb.', 'aNCHOR', 'PQube']",['âge'],NA,First person,"[8968, 11457, 11458, 11778, 15830, 17906, 19075, 62151, 68287, 110779]",rUGP,"""A destiny tossed about, in an insane world---
A flame of life blazing forth, in a dying world---
And now, one more future that is spun---

This is the alternative ending unable to be told before:
A very great, a very tiny, a very precious...
Tale of love and courage.""

Muv-Luv Alternative continues the story of Shirogane Takeru after the events of the original Muv-Luv. This is a tale of a love so deep it breaks all barriers; about courage in the face of adversity and overcoming hardships. Takeru encounters insurmountable odds while his entire world is turned upside down around him.","In Alternative, Shirogane Takeru wakes up three years after the end of Unlimited to find himself back in his room. Although he first thinks that everything that had happened to him was a dream, he soon feels that something is wrong, and leaves the house to find that he has been sent back in time to the beginning of the events in Unlimited. Unwilling to accept something like Alternative V, he decides to help Professor Kozuki to complete Alternative IV and save mankind."
Sushi Striker: The Way of Sushido,76,37179,2018,Tout Public,NA,"['Puzzle', 'Role-playing (RPG)']",0,6,2,['Action'],Yes,2073600,['Nintendo'],"['indieszero Co., Ltd.', 'Nintendo EPD', 'Nintendo']",NA,Bird view / Isometric,"[24426, 25636, 28168, 54775, 55173, 55199, 89597, 96217, 106987, 113636]",NA,"""The ultimate food fight!

In the fast-paced world of conveyor-belt sushi fighting, match colored plates and types of sushi to hurl tall stacks of plates at your opponent. The more matches you make, the taller the plate stack and the stronger your attacks will be. Defend your homeland from invading enemies in this puzzling action game so more people can enjoy delicious sushi in peace. May the best sushi samurai reign supreme!""",
Unravel Two,77,19241,2018,Tout Public,NA,"['Platform', 'Puzzle', 'Adventure']",3,7,4,"['Action', 'Kids']",Yes,9180000,['Electronic Arts'],['ColdWood Interactive'],Yes,Third person,"[20342, 24426, 25646, 28070, 55173, 55190, 56033, 77529, 89074, 89597]",PhyreEngine,"Unravel Two is the sequel to the 2015 puzzle platforming game Unravel. In the game there are two Yarny's (made out of yarn) which can be controlled by one player, though the game can also be played in co-op. Together the Yarny's explore area's and solve the puzzles within them.",
Fallout Shelter,71,11119,2015,16 year,NA,"['Role-playing (RPG)', 'Simulator', 'Strategy']",0,6,6,"['Science fiction', 'Survival']",Yes,2073600,['Bethesda Softworks'],['Bethesda Game Studios'],NA,Side view,"[9789, 17111, 25311, 26145, 26574, 33153, 35994, 44076, 109339, 111187]",Unity,"Fallout Shelter puts you in control of a state-of-the-art underground Vault from Vault-Tec. Build the perfect Vault, keep your Dwellers happy, and protect them from the dangers of the Wasteland.

Vault-Tec has provided the tools, but the rest is up to you. What are you waiting for? Get started building your Vault today for free.",
Hollow Knight,90,14593,2017,Tout Public,NA,"['Platform', 'Adventure', 'Indie']",3,31,5,"['Action', 'Fantasy']",Yes,4785400,['Team Cherry'],['Team Cherry'],NA,Side view,"[3222, 9806, 10388, 11646, 18182, 24426, 26820, 26855, 28070, 36198]",Unity,"A 2D metroidvania with an emphasis on close combat and exploration in which the player enters the once-prosperous now-bleak insect kingdom of Hallownest, travels through its various districts, meets friendly inhabitants, fights hostile ones and uncovers the kingdom's history while improving their combat abilities and movement arsenal by fighting bosses and accessing out-of-the-way areas.",
Jurassic World Evolution,69,54996,2018,16 year,NA,"['Simulator', 'Strategy']",15,38,3,"['Action', 'Science fiction']",Yes,8294400,"['Universal Pictures', 'Frontier Developments']","['Frontier Developments', 'Frontier Developments']",NA,NA,"[13200, 17130, 24620, 25311, 27092, 34823, 35994, 36553, 102057, 111187]",NA,"Take charge of operations on the legendary islands of the Muertes archipelago and bring the wonder, majesty and danger of dinosaurs to life. Build for Science, Entertainment or Security interests in an uncertain world where life always finds a way.

Jurassic World Evolution is a new chapter in the official Jurassic mythology that puts you in charge of cinema’s most famous tourist destination.

Bioengineer dinosaurs that think, feel and react intelligently to the world around them. Play with life itself to give your dinosaurs unique behaviors, traits and appearances, then contain and profit from them to fund your global search for lost dinosaur DNA.

Control the big picture with deep management tools or go hands-on to confront challenges on the ground or in the air. Expand your islands and choose your own journey in an all-new narrative featuring iconic characters from across the franchise and decades of Jurassic lore at your fingertips.",
Paladins,74,11544,2017,Tout Public,NA,"['Shooter', 'Strategy']",0,11,5,"['Action', 'Fantasy', 'Science fiction']",Yes,2073600,['Hi-Rez Studios'],"['Hi-Rez Studios', 'Evil Mojo Games']",Yes,First person,"[3277, 7350, 11646, 16287, 18968, 19164, 23193, 27092, 28204, 55038]",Unreal Engine 3,"Join 25+ million players in Paladins, the free-to-play fantasy team-based shooter sensation. Wield guns and magic as a legendary Champion of the Realm, customizing your core set of abilities to play exactly how you want to play.

Paladins is set in a vibrant fantasy world and features a diverse cast of Champions ranging from sharpshooting humans to mech-riding goblins, mystical elves, and jetpack-clad dragons. Each Champion brings a unique set of abilities to the battlefield and new Champions are regularly added to Paladins, keeping the game exciting.",
Super Bomberman R,62,26760,2017,Tout Public,NA,"['Puzzle', 'Strategy', 'Arcade']",1,28,4,"['Action', 'Party']",Yes,2073600,['Konami'],['Konami'],Yes,Bird view / Isometric,"[25640, 25646, 25905, 27419, 56033, 78550, 90788, 95340, 110503, 119207]",NA,"""Since its release in 1985, Bomberman has been a familiar party-battle game for many years. Now, Bomberman is coming back as ""SUPER BOMBERMAN R"" to Nintendo Switch.

In SUPER BOMBERMAN R, the simple rule remains the same: operate the main character (Bomberman), place bombs, and battle with enemies and rivals, but it's coming back in a modern style with 3D stages and photo-real graphics. You can enjoy battles with rivals from all over the world.

There is ""Battle"" mode for maximum of 8 players, and single play ""Story"" mode (cooperative play for 2 players is possible as well) where players clear each stage one by one, with a big volume of 50 stages. Also, there is a new rule where the condition to clear the stage is not just by wiping out all the enemies. This simple but strategic game with new rules and 3D stages is fun for everyone, from children to adults.""",
Nostalgic Train,N/A,102089,2018,Tout Public,NA,"['Simulator', 'Adventure', 'Indie']",0,15,6,['Mystery'],Yes,1190400,"['Tatamibeya', 'Amata K.K.']",['Tatamibeya'],NA,First person,"[18011, 25311, 26223, 29348, 35994, 79134, 80916, 81275, 87975, 109339]",unreal 4,"A self-described walking simulator with a story and free roam mode.
The setting is a rural area of Japan near a train station.",
R.B.I. Baseball 18,51,83781,2018,Tout Public,NA,"['Sport', 'Arcade']",0,0,5,['Action'],Yes,2073600,['MLB Advanced Media'],"['MLB Advanced Media', 'MLB.com']",No,NA,"[15851, 22690, 43367, 87728, 114285, 115205, 116353, 118871, 119422, 121036]",NA,"R.B.I. Baseball 18 take a huge leap forward delivering all-new Franchise Mode, Home Run Derby Mode, redesigned player models, stunning MLB ballparks and UI presentation. This MLB season get the baseball game that will have you wanting to PLAY IT AGAIN!",
Wreckfest,81,3772,2018,Tout Public,NA,"['Racing', 'Simulator', 'Sport', 'Indie']",31,14,7,['Action'],Yes,2073600,['THQ Nordic'],['Bugbear Entertainment'],NA,First person,"[22387, 25311, 35994, 36198, 36553, 37419, 55190, 78511, 105011, 118871]",ROMU,"Wreckfest is a demolition derby themed racing game with soft-body damage modeling, sophisticated driving dynamics and in-depth vehicle upgrading, featuring both demolition derbies and more traditional track races. It’s all about fun, breakneck racing and over-the-top crashes.","Break the rules and take full-contact racing to the limit with Wreckfest!

Expect epic crashes, neck-to-neck fights over the finish line and brand-new ways for metal to bend. These are the once-in-a-lifetime moments that can only be achieved in Wreckfest, with its true-to-life physics simulation.

Burn rubber and shred metal in the ultimate driving playground!

Wreckfest is jam-packed with upgrade and customization options. Whether you are preparing for your next demolition derby with reinforced bumpers, roll cages, side protectors and much more, or setting your car up for a banger race with engine performance parts like air filters, camshafts, fuel systems, etc., Wreckfest is shaping up to be the best combative motorsport game out there.

Drive hard. Die last.

Exhilarating no-rules racing action with defining, once-in-a-lifetime moments that can be achieved only with a true-to-life physics simulation. Witness insane neck-to-neck fighting on high-speed circuits, face total destruction madness on crazy courses with intersections and oncoming traffic, or go for demolition dominance in derby arenas."
Among Us,85,111469,2018,16 year,NA,"['Strategy', 'Indie']",0,15,8,"['Action', 'Survival', 'Stealth', 'Party']",Yes,778000,['Innersloth'],['Innersloth'],Yes,Bird view / Isometric,"[17379, 19301, 24765, 25311, 26574, 35994, 36553, 81680, 109339, 117497]",Unity,"Play with 4-15 player online or via local WiFi as you attempt to prepare your spaceship for departure, but beware as one or more random players among the Crew are Impostors bent on killing everyone!

Originally created as a party game, we recommend playing with friends at a LAN party or online using voice chat. Enjoy cross-platform play between Android, iOS, PC, and console.","One Crewmate has been replaced by a parasitic shapeshifter. Their goal is to eliminate the rest of the crew before the ship reaches home. The Impostor will sabotage the ship, sneak through vents, deceive, and frame others to remain anonymous and kill off the crew.

While everyone is fixing up the ship, no one can talk to maintain anonymity. Once a body is reported, the surviving crew will openly debate who they think The Impostor is. The Impostor's goal is to pretend that they are a member of the crew. If The Impostor is not voted off, everyone goes back to maintaining the ship until another body is found. If The Impostor is voted off, the crew wins!"
Lego The Incredibles,69,94876,2018,Tout Public,NA,"['Platform', 'Puzzle', ""Hack and slash/Beat 'em up"", 'Adventure']",3,42,5,"['Action', 'Kids', 'Open world']",Yes,2073600,"['Warner Bros. Interactive Entertainment', 'WB Games', 'Feral Interactive']","[""Traveller's Tales"", 'TT Games', 'Feral Interactive']",NA,Third person,"[19241, 20342, 24426, 25646, 28070, 55173, 55190, 56033, 77529, 81249]",NA,LEGO The Incredibles takes players on an adventure where they’ll control their favourite Incredibles characters and team up as a family to conquer crime and family life.,
The Lost Child,62,36535,2017,Tout Public,NA,"['Role-playing (RPG)', 'Adventure']",1,1,3,['Fantasy'],Yes,1125000,"['NIS America', 'Kadokawa Games']","['Crim', 'Kadokawa Games']",NA,First person,"[22387, 25921, 55038, 55199, 81249, 96217, 103303, 106987, 113360, 115653]",NA,"A first-person RPG dungeon crawler set in the present day and continuing the El Shaddai series.
The game uses random encounters and turn-based combat with a team of 5 characters. Creatures can be captured and added to your team, as well as being combined to create more powerful creatures.",
MUSYNX,78,75992,2015,Tout Public,NA,"['Music', 'Simulator', 'Indie', 'Arcade']",0,9,7,[],Yes,2073600,"['Zodiac Interactive', 'PM Studios']",['I-Inferno'],NA,Bird view / Isometric,"[17130, 18981, 23345, 31515, 36269, 37419, 38967, 55590, 65827, 79134]",NA,"Originally developed and published as a mobile app, MUSYNX has received overwhelmingly positive reviews and fan feedback from all over the world. PM Studios is now stepping in to help for this Nintendo Switch version to give it an all-new look from the inside out. The game will feature over 50 musical selections at release! Those who played MUSYNX on mobile are sure to have a familiar, yet totally fresh, experience when it releases on Nintendo Switch in 2018!",
Vegas Party,33,51058,2009,Tout Public,NA,"['Simulator', 'Strategy', 'Card & Board Game']",0,0,1,[],Yes,NA,['Funbox Media'],[],NA,NA,"[17613, 19083, 24620, 31515, 36269, 36346, 55590, 65827, 79134, 112754]",NA,"The game takes the player into the gambling-friendly universe of this over-the-top version of Las Vegas city.

Played as a race, the goal is to reach the end of the Strip before anyone else. Manage your token account in 15 gambling minigames, avoid the dangers like twisters and earthquakes, take advantage of your gaming skills and your good luck, trust no one and forget the meaning of the word “mercy” because it does not apply here!",
Echo VR,N/A,141378,2017,Tout Public,NA,['Sport'],1,0,2,"['Action', 'Science fiction']",Yes,1257472,['Oculus Studios'],['Ready at Dawn'],NA,First person,"[25311, 55038, 68286, 89550, 105269, 107318, 114285, 116353, 118871, 119422]",NA,"The multiplayer mode for Lone Echo that got out of control and became a standalone game.

Free to all, players can squad up or individually progress during each new Echo Pass season in order to earn new Echo Points to unlock exciting rewards. Players can also purchase Echo Points, or upgrade to a premium Echo Pass to triple the amount of rewards earned throughout the Season.

Players can currently redeem Echo Points through Echo Pass or unlock bundles, featured items and limited-item items in the Echo Shop. More ways to redeem will become available as each new season is launched.

---
Experience the freedom of zero-g movement and high energy competition in Echo VR! Team up with friends and clash against AI or opposing Echo Units in the Echo Arena.",
Mario Tennis Aces,75,81145,2018,Tout Public,NA,"['Sport', 'Adventure']",3,11,1,['Action'],Yes,1770000,['Nintendo'],"['Camelot Software Planning', 'Camelot']",Yes,Third person,"[55199, 80916, 87622, 90101, 96217, 103292, 103295, 106987, 111130, 119161]",NA,"A new Mario Tennis game is bringing a new level of skill and competition to Nintendo Switch. Mario steps onto the court in classy tennis garb for intense rallies against a variety of characters in full-blown tennis battles. New wrinkles in tennis gameplay will challenge your ability to read an opponent's position and stroke to determine which shot will give you the advantage. And this time the game adds the first story mode since the Mario Tennis game on Game Boy Advance, offering a new flavor of tennis gameplay, with a variety of missions, boss battles and more",
New Gundam Breaker,43,82116,2018,Tout Public,NA,"['Fighting', 'Shooter', ""Hack and slash/Beat 'em up""]",0,19,2,"['Action', 'Science fiction']",Yes,2073600,"['Bandai Namco Entertainment', 'Bandai Namco Entertainment America', 'Bandai Namco Entertainment Europe']",['Crafts & Meister'],NA,Third person,"[4052, 14704, 55038, 57187, 68286, 89550, 105269, 107318, 114009, 115283]",Unreal Engine,"""Break, build and battle with the Gunpla you’ve always wanted in NEW GUNDAM BREAKER! Blast through enemy Gunplas and collect their fallen weapons and armor to customize your Gunpla in real time and now you can team up with your friends in a 3v3 co-op mode! Don’t miss out on the action in the newest installment of this fan-favorite series!""",
De Blob,82,2637,2008,Tout Public,NA,"['Platform', 'Puzzle', 'Adventure', 'Indie']",0,28,6,"['Action', 'Comedy']",Yes,2073600,"['THQ', 'THQ Wireless', 'THQ Nordic']","['Blue Tongue Entertainment', 'Universomo', 'BlitWorks']",Yes,Third person,"[20329, 20342, 24426, 25646, 28070, 55173, 55190, 56033, 77529, 89597]",NA,"de Blob is a 3D platformer where players maneuver their hero, de Blob. Equal parts amorphous blob of paint, struggling artist, revolutionary and juvenile delinquent, de Blob's goal is to replace the drab, lifeless gray coloring that the I.N.K.T. Corporation has imposed on Chroma City and its inhabitants, the Raydians, with a range of vibrant life-giving colors, all the while avoiding and battling the gray-clad forces of the Inkies.",
Lumines Remastered,83,94970,2018,Tout Public,NA,"['Music', 'Puzzle', 'Indie', 'Arcade']",0,7,4,"['Kids', 'Party']",Yes,2073600,"['Enhance Games', 'Enhance']","['Enhance Games', 'Resonair']",NA,Side view,"[18981, 25222, 25646, 25905, 27266, 56033, 90788, 106992, 108759, 119207]",NA,"Lumines Remastered brings minimalism to the puzzle genre where the fusion of light and sound sets the stage for a two-color falling block experience playable on-the-go on Nintendo Switch or at home in 4K on PC and consoles. Groove to electronic jams while strategically dropping blocks before the BPM bar sweeps combos clean after each measure. It’s a stylish game perfect to play anywhere or at anytime.""",
Nier: Automata,88,11208,2017,18 year,NA,"['Role-playing (RPG)', ""Hack and slash/Beat 'em up""]",32,14,2,"['Action', 'Fantasy', 'Science fiction', 'Drama', 'Open world']",Yes,12000000,['Square Enix'],['PlatinumGames'],NA,Third person,"[7350, 9278, 9938, 11156, 11646, 19164, 19564, 33153, 54775, 55038]",NA,"NieR: Automata tells the story of androids 2B, 9S and A2 and their battle to reclaim the machine-driven dystopia overrun by powerful machines.","The distant future…
Invaders from another world attack without warning, unleashing a new type of threat: weapons known as “machine lifeforms.” In the face of this insurmountable threat, mankind is driven from Earth and takes refuge on the Moon.

The Council of Humanity organizes a resistance of android soldiers in an effort to take back their planet. To break the deadlock, the Resistance deploys a new unit of android infantry: YoRHa .

In the forsaken wasteland below, the war between the machines and the androids rages on. A war that is soon to unveil the long-forgotten truth of this world..."
Rainbow Skies,64,52676,2018,16 year,NA,"['Role-playing (RPG)', 'Strategy', 'Adventure']",0,5,4,[],Yes,2073600,['EastAsiaSoft'],['SideQuest Studios'],NA,Bird view / Isometric,"[25311, 26574, 27092, 28182, 35994, 102420, 103232, 109339, 113402, 115653]",NA,"From the makers of Rainbow Moon comes Rainbow Skies, a new fantasy role-playing game. Immerse yourself in a colorful and vibrant world, filled to the brim with friends and foes, murky dungeons, turn-based battles, towns, shops, and everything else your role-playing heart desires.

Tamable monsters, upgradable characters, and a variety of weapons and equipment offer you a wide range of customization and character development possibilities. Tons of optional and endgame content, side and treasure hunt quests, a humorous story, and other exciting content will keep you hooked for countless hours.","It's a big day for Damion: Today is his final examination as a monster tamer, an important profession in his home town, which is constantly threatened by monster attacks. However, after a terrible hangover, Damion completely messes things up and not only fails the examination but also destroys the entire monster compound.

When he tries to cover up his mishap with his examiner Layne, things turn from bad to worse and through a number of unforeseen circumstances, they find themselves between the fronts of two rival super powers..."
The Awesome Adventures of Captain Spirit,75,103283,2018,Tout Public,NA,['Adventure'],6,20,3,"['Action', 'Drama']",Yes,21304084,['Square Enix'],"[""DON'T NOD""]",NA,NA,"[25646, 55199, 55984, 62151, 87622, 96217, 103266, 103292, 106987, 111130]",NA,"Have you ever dreamt of being a superhero? Meet Chris, a creative and imaginative 9 year old boy who escapes reality with fantastical adventures as his alter ego, the Awesome Captain Spirit! Captain Spirit is a free demo set in the Life is Strange universe.",
Ys VIII: Lacrimosa of Dana,85,27304,2016,Tout Public,NA,"['Role-playing (RPG)', 'Adventure']",0,8,6,"['Action', 'Fantasy']",Yes,720000,"['NIS America', 'Nihon Falcom']",['Nihon Falcom'],No,Third person,"[24426, 28010, 55038, 55199, 81249, 96217, 103303, 106987, 113360, 115280]",NA,"Ys returns with a brand new adventure for the first time in 8 years! Adol awakens shipwrecked and stranded on a cursed island. There, he and the other shipwrecked passengers he rescues form a village to challenge fearsome beasts and mysterious ruins on the isolated island.",
The Night Journey,N/A,105505,2007,Tout Public,NA,"['Adventure', 'Indie']",0,0,3,['Mystery'],Yes,146700,['USC Game Innovation Lab'],"['USC Game Innovation Lab', 'Bill Viola']",NA,First person,"[236, 18011, 20342, 26223, 28070, 77529, 80916, 81275, 96217, 111130]",NA,"The Night Journey is one of the first experimental art games ever made. A collaboration between renowned media artist Bill Viola and designers at the USC Game Innovation Lab, it uses both game and video techniques to tell the universal story of an individual's journey towards enlightenment.",
Ultimate Custom Night,N/A,103629,2018,16 year,NA,"['Simulator', 'Strategy', 'Indie']",0,2,1,['Action'],Yes,2073600,['ScottGames'],['ScottGames'],NA,First person,"[17130, 25311, 31515, 35994, 36269, 36553, 37419, 55590, 65827, 79134]",Clickteam Fusion,"Welcome to the ultimate FNAF mashup, where you will once again be trapped alone in an office fending off killer animatronics! Featuring 50 selectable animatronic characters spanning seven Five Nights at Freddy's games, the options for customization are nearly endless. Mix and match any assortment of characters that you like, set their difficulty from 0-20, then jump right into the action! From your office desk, you will need to manage two side doors, two vents, as well as two air hoses, all of which lead directly into your office.

This time you will have to master other tools as well if you want to complete the ultimate challenges, tools such as the heater, A/C, a global music box, a power generator, and more. As if all of that weren't enough, you'll also need to set up laser traps in the vents, collect Faz-Coins, purchase items from the prize counter, and as always, keep a close eye on not one, but two, Pirate Cove curtains!",
Fighting EX Layer,73,41828,2018,Tout Public,NA,"['Fighting', 'Arcade']",1,13,3,['Action'],Yes,1190400,"['Arika Co., Ltd.']","['Arika Co., Ltd.']",NA,Side view,"[4052, 4260, 10605, 43367, 62285, 87728, 89550, 103369, 109277, 117533]",Unreal Engine,"A video game revealed on April fools day, the trick being it was an actual game that had secretly been in development, that has characters from the Street Fighters EX series but no official name was announced at the time.",
Inside,93,7342,2016,18 year,NA,"['Platform', 'Puzzle', 'Adventure', 'Indie']",11,14,6,"['Action', 'Science fiction', 'Horror', 'Stealth', 'Drama']",Yes,2073600,['Playdead'],['Playdead'],NA,Side view,"[1331, 1334, 1882, 2939, 5601, 7351, 9727, 9730, 11156, 19531]",Unity,"An atmospheric 2D side-scroller in which, hunted and alone, a boy finds himself drawn into the center of a dark project and struggles to preserve his identity.",
Limbo,90,1331,2010,16 year,NA,"['Platform', 'Puzzle', 'Adventure', 'Indie']",1,14,11,"['Action', 'Horror']",Yes,2073600,"['Microsoft Game Studios', 'Playdead']",['Playdead'],NA,Side view,"[533, 1334, 1377, 1882, 1991, 2939, 7342, 7344, 9727, 16992]",NA,Limbo is a black and white puzzle-platforming adventure. Play the role of a young boy traveling through an eerie and treacherous world in an attempt to discover the fate of his sister.,
